{
  "$schema": "../../pattern.schema.json",
  "name": "trpc",
  "description": "tRPC v11 + TanStack React Query. Context with session injection, public/protected procedures, valibot error formatter, batch-stream client, SSR caller and a fetch route handler.",
  "framework": "tanstack-start",
  "detect": {
    "deps": [
      "@trpc/server"
    ],
    "files": []
  },
  "dependsOn": [
    "drizzle"
  ],
  "integratesWith": [
    "better-auth"
  ],
  "deps": [
    "@trpc/server",
    "@trpc/client",
    "@trpc/tanstack-react-query",
    "@tanstack/react-query",
    "superjson",
    "valibot"
  ],
  "env": [],
  "files": [
    {
      "from": "apps/tanstack-base/src/server/api/trpc.ts",
      "to": "<srcRoot>/server/api/trpc.ts"
    },
    {
      "from": "apps/tanstack-base/src/server/api/root.ts",
      "to": "<srcRoot>/server/api/root.ts"
    },
    {
      "from": "apps/tanstack-base/src/server/api/routers/health.router.ts",
      "to": "<srcRoot>/server/api/routers/health.router.ts"
    },
    {
      "from": "apps/tanstack-base/src/routes/api.trpc.$.tsx",
      "to": "<srcRoot>/routes/api.trpc.$.tsx"
    },
    {
      "from": "apps/tanstack-base/src/trpc/react.tsx",
      "to": "<srcRoot>/trpc/react.tsx"
    },
    {
      "from": "apps/tanstack-base/src/trpc/query-client.ts",
      "to": "<srcRoot>/trpc/query-client.ts"
    },
    {
      "from": "apps/tanstack-base/src/trpc/server.ts",
      "to": "<srcRoot>/trpc/server.ts"
    }
  ],
  "notes": [
    "trpc.ts integrates with better-auth: it imports `auth` and injects `session` into the context. If the better-auth pattern is NOT opt-in, strip those imports, the `session` from the context, and protectedProcedure — keep publicProcedure + the timing middleware.",
    "Wire TRPCReactProvider + createQueryClient into the app's root route, and getServerHelpers for SSR preloading (see tanstack-base's router for the exact root wiring)."
  ]
}
